{
  "schemaVersion": "1.0",
  "taskId": "demo-image-cce5a61b-fd1f-4faf-a5d8-6b417cdd6ae7",
  "parentRunId": "9f372976-bce1-49a4-bdf4-cc1eb68136cf",
  "prompt": "Use the fal-creative specialist to create a 16:9 minimalist hero illustration matching the measured website style in the supplied observations. Depict an abstract open book centered in generous whitespace, with a small blue accent. Use the actual observed palette and visual proportions. No text or logos.",
  "requirements": [
    "text_to_image",
    "image"
  ],
  "acceptanceCriteria": [
    "Actual fal request ID",
    "Decoded 16:9 image",
    "Observed website style consumed by planner"
  ],
  "desiredOutput": "image",
  "maxCostUsd": 0.25,
  "allowPaidExecution": true,
  "timeoutMs": 180000,
  "context": {
    "websiteObservations": {
      "sourceUrl": "https://example.com/",
      "pageTitle": "Example Domain",
      "agentSummary": "Inspected `[public URL on example.com]` in a fresh browser session and captured exactly one screenshot.\n\nObservations:\n- Page title: `Example Domain`\n- Visible content: short documentation/example-domain notice in multiple languages plus a “Learn more” link.\n- Visual style measured:\n  - Background: `rgb(238, 238, 238)`\n  - Body text: `rgb(0, 0, 0)`\n  - Link color: `rgb(0, 0, 238)`\n  - Font: `system-ui, sans-serif`\n  - Body font size: `16px`\n  - Line height: `25.6px`\n  - Main content box: approximately `480px` wide, positioned at `x=400`, `y=0` in a `1280×720` viewport.\n\nUncertainty:\n- Heading-specific typography was not separately detected by the extractor.\n- Screenshot saved by the browser tool in the task artifact directory.",
      "visualStyle": {
        "viewport": {
          "width": 1280,
          "height": 720
        },
        "palette": {
          "pageBackground": "rgb(238, 238, 238)",
          "bodyText": "rgb(0, 0, 0)",
          "heading": null,
          "link": "rgb(0, 0, 238)"
        },
        "typography": {
          "bodyFontFamily": "system-ui, sans-serif",
          "bodyFontSize": "16px",
          "bodyLineHeight": "25.6px",
          "headingFontFamily": null,
          "headingFontSize": null,
          "headingFontWeight": null
        },
        "layout": {
          "mainContentBox": {
            "x": 400,
            "y": 0,
            "width": 480,
            "height": 775
          }
        }
      },
      "screenshotPath": "/Users/0x79de/dev/harnessrouter/artifacts/9f372976-bce1-49a4-bdf4-cc1eb68136cf/pi-browser-9f372976-bce1-49a4-bdf4-cc1eb68136cf.png"
    },
    "creativeOptions": {
      "aspectRatio": "16:9",
      "quality": "balanced",
      "style": "minimal geometric editorial illustration",
      "seed": 42
    }
  }
}